ID,HOSPITAL NAME,CITY,STATE,REASON FOR DELETION
6160350,Milford Hospital,Milford,CT,"Merged into 6160002 Bridgeport Hospital Bridgeport, CT"
6210050,Albany Memorial Hospital,Albany,NY,"Merged into 6214990 Samaritan Hospital Troy, NY"
6211540,St. Joseph's Hospital,Elmira,NY,"Merged into 6211510 Arnot Ogden Medical Center Elmira, NY"
6211770,Stony Brook Eastern Long Island Hospital,Greenport,NY,"Merged into 6214775 Stony Brook University Hospital Stony Brook, NY"
6212450,NYU Winthrop Hospital,Mineola,NY,"Merged into 6212925 NYU Langone Hospitals New York, NY"
6220022,CareOne at Raritan Bay Medical Center,Perth Amboy,NJ,Closed
6230083,LifeCare Hospitals of Chester County,West Chester,PA,Closed
6230200,Bradford Regional Medical Center,Bradford,PA,"Merged into 6210009 Olean General Hospital Olean, NY"
6230506,Kirkbride Center,Philadelphia,PA,Substance Abuse Center
6230720,"Ellwood City Medical Center, LLC",Ellwood City,PA,Closed
6231140,UPMC Pinnacle Lancaster,Lancaster,PA,Closed
6231890,Hahnemann University Hospital,Philadelphia,PA,Closed
6232200,Kindred Hospital South Philadelphia,Philadelphia,PA,Closed
6233200,UPMC Susquehanna Sunbury,Sunbury,PA,Closed
6233485,UPMC Susquehanna Divine Providence Campus,Williamsport,PA,"Merged into 6233500 UPMC Williamsport Williamsport, PA"
6320440,McCready Health,Crisfield,MD,"Merged into 6320785 TidalHealth Peninsula Salisbury, MD"
6322080,Adventist Healthcare Washington Adventist Hospital,Takoma Park,MD,Temporarily inactive unit
6341220,Hallmark Youthcare - Richmond,Richmond,VA,Behavioral Health Center
6350070,Bluefield Regional Medical Center,Bluefield,WV,Emergency Urgent Care Center
6350300,Fairmont Regional Medical Center,Fairmont,WV,Closed
6350820,Ohio Valley Medical Center,Wheeling,WV,Closed
6350840,Williamson Memorial Hospital,Williamson,WV,Closed
6360825,Atrium Health Kings Mountain,Kings Mountain,NC,"Merged into 6361370 Atrium Health Cleveland Shelby, NC"
6369137,Strategic Behavioral Health - Charlotte,Charlotte,NC,Closed
6380036,Kindred Hospital Rome,Rome,GA,Closed
6380260,University Hospital Summerville,Augusta,GA,"Merged into 6380270 University Hospital Augusta, GA"
6390128,The Centers,Ocala,FL,Behavioral Health Center
6390450,Shands Lake Shore Regional Medical Center,Lake City,FL,Closed
6390498,Shands Live Oak Regional Medical Center,Live Oak,FL,Urgent Care Center
6390995,Shands Starke Regional Medical Center,Starke,FL,Urgent Care Center
6391128,JFK Medical Center North Campus,West Palm Beach,FL,"Merged into 6390074 JFK Medical Center Atlantis, FL"
6391146,Regional General Hospital,Williston,FL,Closed
6410076,Ten Lakes Center,Dennison,OH,Closed
6410576,Cambridge Behavioral Hospital,Cambridge,OH,Closed
6411660,East Ohio Regional Hospital,Martins Ferry,OH,Closed
6412110,ProMedica Flower Hospital,Sylvania,OH,"Merged into 6412180 Promedica Toledo Hospital Toledo, OH"
6420210,Fayette Regional Health System,Connersville,IN,Closed
6420285,Vibra Hospital of Fort Wayne,Fort Wayne,IN,Closed
6420290,Deaconess Gateway Hospital,Newburgh,IN,"Merged into 6420320 Deaconess Midtown Hospital Evansville, IN"
6430270,MetroSouth Medical Center,Blue Island,IL,Closed
6430640,Chicago Lakeshore Hospital,Chicago,IL,Closed
6432200,Westlake Hospital,Melrose Park,IL,Closed
6450016,Post Acute Medical Specialty Hospital of Milwaukee,Greenfield,WI,Closed
6450024,LifeCare Hospitals of Wisconsin,Pewaukee,WI,Closed
6450029,Columbia Center Birth Hospital,Mequon,WI,Closed
6510042,Our Lady of Bellefonte Hospital,Ashland,KY,Closed
6520320,Greeneville Community Hospital East,Greeneville,TN,"Merged into 6520340 Greenville Community Hospital East Greenville, TN"
6520455,Ten Broeck Tennessee Treatment Facility,Cookeville,TN,Closed
6520935,Saint Thomas Midtown Hospital,Nashville,TN,"Merged into 6521040 Saint Thomas West Hospital Nashville, TN"
6521111,Decatur County General Hospital,Parsons,TN,Closed
6539015,Pickens County Medical Center,Carrollton,AL,Closed
6610001,Phillips Eye Institute,Minneapolis,MN,"Merged into 6610815 Abbott Northwestern Hospital Minneapolis, MN"
6611800,Mayo Clinic Health System in Springfield,Springfield,MN,Closed
6620410,UnityPoint Health-Iowa Lutheran Hospital,Des Moines,IA,"Merged into 6620420 UnityPoint Health-Iowa Methodist Medical Center Des Moines, IA"
6621200,Sanford Rock Rapids Medical Center,Rock Rapids,IA,Closed
6630027,Select Specialty Hospital-Western Missouri,Kansas City,MO,Closed
6630040,Pinnacle Regional Hospital,Boonville,MO,Closed
6630410,Two Rivers Behavioral Health System,Kansas City,MO,Closed
6670467,Blue Valley Hospital,Overland Park,KS,Emergency Care Center
6671080,Sumner Community Hospital,Wellington,KS,Closed
6710314,North Metro Medical Center,Jacksonville,AR,Closed
6720066,Memorial Specialty Hospital,Lake Charles,LA,Closed
6720119,Heart Hospital of Lafayette,Lafayette,LA,"Merged into 6720343 Our Lady of Lourdes Regional Medical Center Lafayette, LA"
6720145,Lafayette Surgical Specialty Hospital,Lafayette,LA,"Merged into  6720340 Oschner Lafayette General Medical Center Lafayette, LA"
6720198,Lafayette General Surgical Hospital,Lafayette,LA,"Merged into  6720340 Oschner Lafayette General Medical Center Lafayette, LA"
6720345,Women's and Children's Hospital,Lafayette,LA,"Merged into 6720343 Our Lady of Lourdes Regional Medical Center Lafayette, LA"
6720374,Oceans Behavioral Hospital of Kentwood,Kentwood,LA,Closed
6720388,St. Catherine Memorial Hospital,New Orleans,LA,Closed
6720504,Oceans Behavioral Hospital of Crowley,Rayne,LA,Closed
6730056,Integris Bass Pavilion,Enid,OK,Closed
6730780,INTEGRIS Deaconess,Oklahoma City,OK,"Merged into 6730728 INTEGRIS Baptist Medical Center Oklahoma City, OK"
6731088,Stroud Regional Medical Center,Stroud,OK,Closed
6731185,Shadow Mountain Behavioral Health System,Tulsa,OK,Closed
6740022,Encompass Health Rehabilitation Hospital of Fort Worth,Fort Worth,TX,Closed
6740049,Kindred Rehabilitation Hospital Clear Lake,Webster,TX,"Merged into 6741151 PAM Rehabilitation Hospital of Clear Webster, TX"
6740068,AMG Specialty Hospital,San Antonio,TX,Closed
6740096,Kindred Hospital-Fort Worth,Fort Worth,TX,Closed
6740116,SCA Houston Hospital for Specialized Surgery,Houston,TX,Closed
6740230,CHRISTUS Dubuis Hospital of Paris,Paris,TX,Closed
6740262,Mid-Jefferson Extended Care Hospital,Nederland,TX,"Merged into 6741036 Mid-Jefferson Extended Care Hospital of Beaumont Beaumont, TX"
6740292,PAM Specialty Hospital of Corpus Christi South,Corpus Christi,TX,Closed
6740373,Kindred Hospital Tomball,Tomball,TX,Closed
6740391,Atrium Medical Center of Corinth,Corinth,TX,Closed
6740394,Sagecrest Hospital of Grapevine,Grapevine,TX,Closed
6740410,USMD Hospital at Fort Worth,Fort Worth,TX,Closed
6740597,Chillicothe Hospital District,Chillicothe,TX,Closed
6740658,Select Rehabilitation Hospital of San Antonio,San Antonio,TX,"Merged into 6740417 Methodist Stone Oak Hospital San Antonio, TX"
6740887,Sundance Hospital Arlington,Arlington,TX,Closed
6740898,Kindred Rehabilitation Hospital Northeast Houston,Humble,TX,Closed
6740929,HEALTHSOUTH Rehabilitation Hospital - Austin,Austin,TX,Closed
6740940,Hermann Drive Surgical Hospital,Houston,TX,Closed
6740956,Plano Surgical Hospital,Plano,TX,Closed
6740969,ContinueCARE Hospital at Midland Memorial,Midland,TX,Closed
6740970,Kindred Hospital-Dallas,Dallas,TX,Closed
6741042,Memorial Hermann Tomball Hospital,Tomball,TX,Closed
6741044,"William P. Clements, Jr. University Hospital",Dallas,TX,"Merged into 6740343 University of Texas Southwestern Medical Center Dallas, TX"
6741094,Providence Hospital of North Houston,Houston,TX,Closed
6741616,Baylor Medical Center at Garland,Garland,TX,Closed
6741735,Texas General Hospital - Van Zandt Regional Medical Center,Grand Saline,TX,Closed
6742150,Allegiance Specialty Hospital of Kilgore,Kilgore,TX,Closed
6743070,Nix Health Care System,San Antonio,TX,Closed
6830069,Mountain View Regional Hospital,Casper,WY,Urgent Care Center
6840156,Kindred Hospital Denver South,Denver,CO,Closed
6860290,St. Luke's Medical Center,Phoenix,AZ,Closed
6860454,Scottsdale Liberty Hospital,Scottsdale,AZ,Closed
6860483,Hacienda Children's Hospital,Mesa,AZ,Closed
6870330,University of Utah Neuropsychiatric Institute,Salt Lake City,UT,"Merged into 6870315 University of Utah Health Salt Lake City, UT"
6879349,Landmark Hospital of Salt Lake City,Murray,UT,Closed
6910802,Kindred Hospital Seattle-Northgate,Seattle,WA,Closed
6911240,Astria Regional Medical Center,Yakima,WA,Closed
6931570,Promise Hospital of East Los Angeles,Los Angeles,CA,Closed
6931730,St. Vincent Medical Center,Los Angeles,CA,Closed
6940205,Sitka Community Hospital,Sitka,AK,Closed
