ID,HOSPITAL NAME,CITY,STATE,REASON FOR DELETION
6140014.0,Curahealth Hospital Boston,Brighton,MA,Closed
6141670.0,Curahealth Boston North Shore,Peabody,MA,Closed
6150001.0,Memorial Hospital of Rhode Island,Pawtucket,RI,Closed
6160015.0,Wellspring Foundation,Bethlehem,CT,Residential Treatment Facility
6210400.0,New York-Presbyterian/Lawrence Bronxville,Hospital,NY,Unit of 6210024 New York-Presbyterian Hospital - New
6214612.0,TLC Health Network - Lake Shore Irving,Hospital,NY,"Unit of 6211470 Brooks Memorial Hospital - Dunkirk, NY"
6214950.0,Moses Ludington Hospital,Ticonderoga,NY,Unit of 6211490 The University of Vermont Health
6221270.0,Runnells Center for Rehabilitation Berkeley Heights and,Healthcare,NJ,Nursing Facility
6320417.0,Warwick Manor Behavioral Health East New,Market,MD,Psychiatric Facility
6341136.0,Pioneer Community Hospital of Stuart,Patrick,VA,Closed
6349040.0,Woodrow Wilson Rehabilitation Fishersville,Center,VA,Ambulatory Care Facility
6360710.0,FirstHealth Moore Regional Hospital Hamlet -,Hamlet,NC,Closed
6361363.0,Our Community Hospital Scotland,Neck,NC,Closed
6380031.0,Select Specialty Hospital-Atlanta,Atlanta,GA,Closed
6380039.0,Select Specialty Hospital - Northeast Atlanta,Atlanta,GA,Closed
6380464.0,Chestatee Regional Hospital,Dahlonega,GA,Closed
6390211.0,Atlantic Shores Hospital Fort,Lauderdale,FL,Closed
6390281.0,Campbellton Graceville Hospital,Graceville,FL,Closed
6390508.0,Fishermen's Hospital,Marathon,FL,Temporarily Closed
6410056.0,Kindred Hospital of Central Ohio,Mansfield,OH,Closed
6411550.0,Oakwood Correctional Facility,Lima,OH,Closed
6411670.0,Affinity Medical Center,Massillon,OH,Closed
6420013.0,Kindred Hospital Indianapolis South,Greenwood,IN,Closed
6420035.0,Kindred Hospital of Northern Indiana,Mishawaka,IN,Closed
6430435.0,RML Specialty Hospital,Chicago,IL,"Unit of 6431925 RML Specialty Hospital - Hinsdale, IL"
6440028.0,Great Lakes Specialty Hospital- Grand Rapids Grand,Rapids,MI,Closed
6440042.0,Kindred Hospital Detroit,Detroit,MI,Closed
6441178.0,Spectrum Health Special Care Grand Rapids,Hospital,MI,Closed
6510100.0,NorthKey Community Care,Covington,KY,Psychiatric Facility
6510180.0,Ireland Army Community Hospital Fort,Knox,KY,Ambulatory Care Facility
6510450.0,Shriners Hospitals for Children- Lexington,Lexington,KY,Ambulatory Surgical Facility
6520033.0,Select Specialty Hospital-Knoxville,Knoxville,TN,Unit of 6520034 Select Specialty Hospital-North Knoxville
6520213.0,Copper Basin Medical Center,Copperhill,TN,Closed
6520410.0,Tennova Healthcare Regional Jackson Hospital of,Jackson,TN,Unit of 6524010 West Tennessee Healthcare North
6520655.0,Peninsula Hospital,Louisville,TN,"Unit of 6520530 Parkwest Medical Center - Knoxville, TN"
6530535.0,RMC Jacksonville,Jacksonville,AL,Closed
6539030.0,J. Paul Jones Hospital,Camden,AL,Urgent Care Center
6620131.0,Continuing Care Hospital at St. Cedar Rapids,Luke's,IA,Closed
6670495.0,Rainbow Mental Health Facility Kansas,City,KS,Closed
6720013.0,LifeCare Hospitals of Shreveport,Shreveport,LA,Closed
6720094.0,WK Bossier Health Center Bossier,City,LA,Unit of 6720877 Willis-Knighton Medical Center -
6720134.0,Promise Hospital of Baton Rouge - Baton Rouge Mid-City,Campus,LA,Unit of 6720135 Promise Hospital of Baton Rouge -
6720207.0,Calcasieu Oaks Geriatric Psychiatric Lake Charles,Hospital,LA,Unit of 6720147 South Cameron Memorial Hospital -
6720364.0,Compass Behavioral Center of Crowley,Crowley,LA,Closed
6720379.0,Acadia Optima Hospital,Lafayette,LA,Unit of 6720390 Vermilion Behavioral Health Systems -
6730016.0,AMG Specialty Hospital-Edmond,Edmond,OK,Closed
6730026.0,AMG Specialty Hospital-Tulsa,Tulsa,OK,Closed
6740109.0,Care Regional Medical Center Aransas,Pass,TX,Closed
6740143.0,Plum Creek Specialty Hospital,Amarillo,TX,Closed
6740161.0,Lifecare Hospitals of South Texas- McAllen North,McAllen,TX,Closed
6740273.0,Memorial Hermann Surgical Sugar Land Hospital - First,Colony,TX,Ambulatory Surgical Center
6740283.0,Abilene Behavioral Health,Abilene,TX,Closed
6740286.0,Nix Community General Hospital,Dilley,TX,Closed
6740294.0,Kindred Hospital-White Rock,Dallas,TX,Closed
6740305.0,Select Specialty Hospital-South Dallas,Dallas,TX,Closed
6740351.0,Kindred Rehabilitation Hospital Arlington,Arlington,TX,Closed
6740393.0,Cook Children's Northeast Hospital,Hurst,TX,Urgent Care Center
6740843.0,Houston County Medical Center,Crockett,TX,Closed
6740888.0,Hopebridge Hospital,Houston,TX,Closed
6740920.0,Lakeway Regional Medical Center,Lakeway,TX,Unit of 6740381 Baylor Scott & White Medical Center -
6740958.0,Victory Medical Center Landmark San,Antonio,TX,Closed
6740979.0,Walnut Hill Medical Center,Dallas,TX,Closed
6741029.0,Bay Area Regional Medical Center,Webster,TX,Closed
6741054.0,Weimar Medical Center,Weimar,TX,Closed
6742327.0,CHRISTUS Good Shepherd Medical Longview,Center,TX,Unit of 6742430 CHRISTUS Good Shepherd Medical
6743320.0,Stamford Memorial Hospital,Stamford,TX,Ambulatory Care Center
6860042.0,Gilbert Hospital,Gilbert,AZ,Closed
6860056.0,Yavapai Regional  Medical Center - Prescott Valley,East,AZ,Unit of 6860320 Yavapai Regional Medical Center -
6860256.0,Abrazo Maryvale Campus,Phoenix,AZ,Closed
6930440.0,Coalinga Regional Medical Center,Coalinga,CA,Closed
6931510.0,Pacific Alliance Medical Center Los,Angeles,CA,Closed
6933721.0,Tulare Regional Medical Center,Tulare,CA,Temporarily Closed
